{
  "schema_version": "agent_joint_forecast_report_v4",
  "report_mode": "joint_forecast",
  "truth_accessed": false,
  "dataset_split": "independent_test",
  "evaluation_character": "nonblind_existing_split_replay",
  "hazard": "heatwave",
  "case_id": "20200729_00",
  "region_id": "SA-04",
  "lead_time_hours": 48,
  "selected_joint_rule": "joint_heat_pooled_median_loco_kg_temporal_or_spatial_margin1p0_windows3_maxmargin0p0",
  "base_method": "pooled_median_loco",
  "knowledge_mode": "temporal_or_spatial",
  "base_risk_level": "high",
  "knowledge_triggered": false,
  "joint_final_risk_level": "high",
  "decision_change": "unchanged",
  "development_gate_passed": false,
  "operating_status": "research_only_blocked",
  "formal_warning_allowed": false,
  "forecast_features": {
    "candidate_tmax_degc": 50.505766,
    "hot_day_threshold_degc": 47.249969
  },
  "conclusion_zh": "20200729_00 / SA-04 / +48h 的 heatwave 联合风险为 high。开发门槛未通过，当前状态为 research_only_blocked，不能直接视为正式业务预警。",
  "knowledge_reasoning_zh": "图谱一致性规则未触发，联合风险保持基础判断 high；未使用同期观测或事后答案进行改写。",
  "limitations_zh": [
    "本报告只读取无真值预测锁；命中、漏报和误报只能在锁定后的验证阶段计算。",
    "联合候选是在已打开的development样本上回顾性选择，存在样本量小和选择偏差风险。",
    "该独立划分此前已经打开，本次属于非盲全链回放。",
    "高温没有独立对照案例，且最佳候选未通过development全部门槛。"
  ],
  "recommended_actions_zh": [
    "保留基础风险与联合风险两列，供人工追溯图谱是否改变了结论。",
    "仅用于研究和人工复核；补充独立高温对照案例前不得启用正式预警。"
  ],
  "provenance": {
    "prediction_lock_path": "handoff/model_selection/joint_v2/locked_joint_heatwave_predictions.csv",
    "prediction_lock_sha256": "42ffbc31f74ddefeb964cb05d64dc5e288bff4e011e280af19fed16cab092704",
    "selection_lock_path": "manifests/joint_pipeline_selection_lock_v2.json",
    "selection_lock_sha256": "8d3526d9f6528378d274129ad424cba39904a5cfcce2e164fc62fe7b4ca55545"
  }
}
